{
  "jurisdiction": "in",
  "name": "India",
  "version": "2026.10.1",
  "last_checked": "2026-10-12",
  "review_status": "draft",
  "sources": [
    {
      "id": "rbi-dl-2025",
      "title": "Reserve Bank of India (Digital Lending) Directions, 2025",
      "url": "https://www.rbi.org.in/scripts/BS_CircularIndexDisplay.aspx?Id=12848",
      "clauses": [
        {
          "id": "kfs",
          "reference": "Key Fact Statement (paragraph to be confirmed by counsel)",
          "summary": "The borrower receives a Key Fact Statement in a standard format before executing the loan contract."
        },
        {
          "id": "apr",
          "reference": "Annual Percentage Rate disclosure (paragraph to be confirmed by counsel)",
          "summary": "The all-inclusive cost of the loan is disclosed as an Annual Percentage Rate, together with tenor and repayment terms."
        },
        {
          "id": "data-storage",
          "reference": "Data storage (paragraph to be confirmed by counsel)",
          "summary": "Borrower data collected for digital lending is stored on servers located in India."
        }
      ]
    }
  ],
  "rules": [
    {
      "id": "IN-KFS-01",
      "title": "Key Fact Statement acknowledged before the contract",
      "severity": "critical",
      "stage": "post_decision",
      "check": { "fact": "disclosure.acknowledged", "op": "true" },
      "on_fail": "fail",
      "pass_detail": "The borrower acknowledged the Key Fact Statement before signing.",
      "fail_detail": "The Key Fact Statement has not been acknowledged by the borrower.",
      "cites": [{ "source": "rbi-dl-2025", "clause": "kfs" }]
    },
    {
      "id": "IN-APR-01",
      "title": "Loan offer shows APR, tenor and repayment terms",
      "severity": "major",
      "stage": "pre_decision",
      "check": {
        "all": [
          { "fact": "disclosure.apr_pct", "op": "present" },
          { "fact": "disclosure.instalments", "op": "gte", "value": 1 },
          { "fact": "disclosure.instalment", "op": "present" }
        ]
      },
      "on_fail": "fail",
      "pass_detail": "APR, number of instalments and instalment amount are disclosed.",
      "fail_detail": "The offer is missing the APR, tenor or repayment amount.",
      "cites": [{ "source": "rbi-dl-2025", "clause": "apr" }]
    },
    {
      "id": "IN-DAT-01",
      "title": "Borrower data stored in India",
      "severity": "major",
      "stage": "pre_decision",
      "check": { "fact": "storage.region", "op": "in", "value": ["asia-south1", "asia-south2"] },
      "on_fail": "review",
      "pass_detail": "Case data is stored in an Indian cloud region.",
      "fail_detail": "Case data is not stored in an Indian region. Deploy an India instance before lending in India.",
      "cites": [{ "source": "rbi-dl-2025", "clause": "data-storage" }]
    }
  ]
}
